[
  {
    "id": "paddleocr-vl-rocm-full-1651-2026-08-06",
    "model": "PaddleOCR-VL-1.6",
    "model_version": "1.6",
    "adapter": "paddleocr-vl-1.6",
    "backend": "llama.cpp GGUF (ROCm/HIP)",
    "device": "AMD Ryzen AI MAX+ 395 / Radeon 8060S",
    "gfx_architecture": "gfx1151",
    "driver": null,
    "dataset_version": "OmniDocBench v1.6 (1651 pages)",
    "date": "2026-08-06",
    "page_count": 1651,
    "prediction_coverage": 0.998789,
    "failed_pages": 2,
    "known_failures": 2,
    "unknown_failures": 0,
    "scoring_mode": "quick_match",
    "aggregation_mode": "text_ro_page_avg_teds_pooled_cdm_pooled",
    "raw_metrics": {
      "text_edit_dist": 0.035251,
      "reading_order_edit_dist": 0.129328,
      "table_teds_pooled": 0.929792,
      "table_teds_page_avg": 0.940989,
      "formula_cdm": 0.965605
    },
    "display_metrics": {
      "overall": null,
      "table_teds": 92.9792,
      "formula_cdm": 96.5605
    },
    "run_type": "resumed",
    "evidence_level": "validated resumed run on the final orchestrator state (commit dfd8962, 2026-08-06). The two known failures are the allowlisted peg-native upstream pages (PaddlePaddle/PaddleOCR#18248). The run required one failed-stage resume and a machine-local long-path shim, which was replaced by the tracked long-path fix at commit 252a6e2; clean-room status is not claimed.",
    "repo_commit": "dfd89624c0e7f5f93b91ec1e4f90166da5c60f59",
    "profile_hash": "f80cbf1a46b1713b9073fc129e075b7d4190dae0a4c38f118ece1c1e14906dc9",
    "prediction_tree_hash": "17365b4a7bf823605ba8bb6773e16b01a5ac9b8c873fb078d8d893b2756379f8",
    "result_hashes": {
      "windows_metric_result": "38d895b6859461deeb8a8b1e2f8547fa87233e6b126ed5759965648012ecf990",
      "wsl_metric_result": "2c11781fa9c94bd9d053f95e9cbaeb97fcdd4835c13d43228f44e969275d0ba4",
      "strict_prediction_summary": "229cc7f081a4304a6273d20e0cc8cb1dea70f4901f43e9ce52a15a007f1dbbbc",
      "state": "4938a91a7b9d027757764371d43425ce30cded2fab021e88779be088dff68a8e",
      "report": "5741146747897f5ef6a8f92d25a1c2bb45b28831ace27e0941394cac0ae4dfce",
      "backend_proof": "bde05e546cfc73b3aff1bad0c2726d043ab35c254420b23821895082bda15d3a"
    },
    "evidence_document": "docs/reproduction-full1651-hip-2026-08-06.md"
  },
  {
    "id": "paddleocr-vl-rocm-full-1651-2026-08-03",
    "model": "PaddleOCR-VL-1.6",
    "model_version": "1.6",
    "adapter": "paddleocr-vl-1.6",
    "backend": "llama.cpp GGUF (ROCm/HIP)",
    "device": "AMD Ryzen AI MAX+ 395 / Radeon 8060S",
    "gfx_architecture": "gfx1151",
    "driver": null,
    "dataset_version": "OmniDocBench v1.6 (1651 pages)",
    "date": "2026-08-03",
    "page_count": 1651,
    "prediction_coverage": 0.998789,
    "failed_pages": 2,
    "known_failures": 2,
    "unknown_failures": 0,
    "scoring_mode": "quick_match",
    "aggregation_mode": "text_ro_page_avg_teds_pooled_cdm_pooled",
    "raw_metrics": {
      "text_edit_dist": 0.035386,
      "reading_order_edit_dist": 0.129539,
      "table_teds_pooled": 0.929766,
      "table_teds_page_avg": null,
      "formula_cdm": 0.96649
    },
    "display_metrics": {
      "overall": null,
      "table_teds": 92.9766,
      "formula_cdm": 96.649
    },
    "run_type": "resumed",
    "evidence_level": "validated resumed run on the final orchestrator state; the two known failures are the peg-native upstream pages (PaddlePaddle/PaddleOCR#18248). A clean-room full run on a fresh checkout is required before this row may be labelled clean-room.",
    "repo_commit": null,
    "profile_hash": null,
    "prediction_tree_hash": null,
    "result_hashes": null,
    "evidence_document": "docs/reproduction-full1651-hip-2026-08-03.md"
  },
  {
    "id": "paddleocr-vl-rocm-reference-2026-07-11",
    "model": "PaddleOCR-VL-1.6",
    "model_version": "1.6",
    "adapter": "paddleocr-vl-1.6",
    "backend": "llama.cpp GGUF (ROCm/HIP)",
    "device": "AMD Ryzen AI MAX+ 395 / Radeon 8060S",
    "gfx_architecture": "gfx1151",
    "driver": null,
    "dataset_version": "OmniDocBench v1.6 (1651 pages)",
    "date": "2026-07-11",
    "page_count": 1651,
    "prediction_coverage": 0.998789,
    "failed_pages": 2,
    "known_failures": 2,
    "unknown_failures": 0,
    "scoring_mode": "quick_match",
    "aggregation_mode": "page_avg_official_notebook",
    "raw_metrics": {
      "text_edit_dist": 0.03402,
      "reading_order_edit_dist": 0.12824,
      "table_teds_pooled": 0.931345,
      "table_teds_page_avg": null,
      "formula_cdm": 0.969219
    },
    "display_metrics": {
      "overall": 95.99,
      "table_teds": 94.3222,
      "formula_cdm": 96.9219
    },
    "run_type": "resumed",
    "evidence_level": "reference row (README table) per the official notebook page-level aggregation; evidence in docs/windows-native-cdm-verification-2026-07-11.md and docs/release-paddleocr-vl-1.6-amd-windows-2026-07-16.md.",
    "repo_commit": null,
    "profile_hash": null,
    "prediction_tree_hash": null,
    "result_hashes": null,
    "evidence_document": "docs/windows-native-cdm-verification-2026-07-11.md"
  },
  {
    "id": "paddleocr-vl-official-engine-2026-07-11",
    "model": "PaddleOCR-VL-1.6",
    "model_version": "1.6",
    "adapter": "paddleocr-vl-1.6",
    "backend": "llama.cpp GGUF (ROCm/HIP), official doc_parser engine",
    "device": "AMD Ryzen AI MAX+ 395 / Radeon 8060S",
    "gfx_architecture": "gfx1151",
    "driver": null,
    "dataset_version": "OmniDocBench v1.6 (1651 pages)",
    "date": "2026-07-11",
    "page_count": 1651,
    "prediction_coverage": 0.998789,
    "failed_pages": 2,
    "known_failures": 2,
    "unknown_failures": 0,
    "scoring_mode": "quick_match",
    "aggregation_mode": "page_avg_official_notebook",
    "raw_metrics": {
      "text_edit_dist": 0.03444,
      "reading_order_edit_dist": 0.12949,
      "table_teds_pooled": null,
      "table_teds_page_avg": null,
      "formula_cdm": 0.965022
    },
    "display_metrics": {
      "overall": null,
      "table_teds": 94.2393,
      "formula_cdm": 96.5022
    },
    "run_type": "resumed",
    "evidence_level": "official-engine comparison row; local Windows-native CDM rerun log (Text 0.034, RO 0.129, TEDS 94.2393, CDM 96.5022, 2352 CDM samples, 0 timeouts, 0 exceptions).",
    "repo_commit": null,
    "profile_hash": null,
    "prediction_tree_hash": null,
    "result_hashes": null,
    "evidence_document": "docs/release-paddleocr-vl-1.6-amd-windows-2026-07-16.md"
  },
  {
    "id": "paddleocr-vl-rocm-release-2026-07-16",
    "model": "PaddleOCR-VL-1.6",
    "model_version": "1.6",
    "adapter": "paddleocr-vl-1.6",
    "backend": "llama.cpp GGUF (ROCm/HIP)",
    "device": "AMD Ryzen AI MAX+ 395 / Radeon 8060S",
    "gfx_architecture": "gfx1151",
    "driver": null,
    "dataset_version": "OmniDocBench v1.6 (1651 pages)",
    "date": "2026-07-16",
    "page_count": 1651,
    "prediction_coverage": 0.998789,
    "failed_pages": 2,
    "known_failures": 2,
    "unknown_failures": 0,
    "scoring_mode": "quick_match",
    "aggregation_mode": "page_avg_official_notebook",
    "raw_metrics": {
      "text_edit_dist": 0.03488,
      "reading_order_edit_dist": 0.12882,
      "table_teds_pooled": 0.940865,
      "table_teds_page_avg": null,
      "formula_cdm": 0.9736
    },
    "display_metrics": {
      "overall": 95.99,
      "table_teds": 94.09,
      "formula_cdm": 97.36
    },
    "run_type": "resumed",
    "evidence_level": "reference row published in docs/release-paddleocr-vl-1.6-amd-windows-2026-07-16.md; page-level TEDS 94.09 rounds from raw 94.0865.",
    "repo_commit": null,
    "profile_hash": null,
    "prediction_tree_hash": null,
    "result_hashes": null,
    "evidence_document": "docs/release-paddleocr-vl-1.6-amd-windows-2026-07-16.md"
  },
  {
    "id": "mineru25-pro-2605-1.2b-2026-08-01",
    "model": "MinerU2.5-Pro-2605-1.2B",
    "model_version": "2605-1.2B",
    "adapter": "mineru",
    "backend": "llama.cpp GGUF (HIP)",
    "device": "AMD Ryzen AI MAX+ 395 / Radeon 8060S",
    "gfx_architecture": "gfx1151",
    "driver": null,
    "dataset_version": "OmniDocBench v1.6 (1651 pages)",
    "date": "2026-08-01",
    "page_count": 1651,
    "prediction_coverage": null,
    "failed_pages": null,
    "known_failures": null,
    "unknown_failures": null,
    "scoring_mode": "quick_match",
    "aggregation_mode": "quick_match_cdm",
    "raw_metrics": {
      "text_edit_dist": 0.03734,
      "reading_order_edit_dist": 0.1225,
      "table_teds_pooled": 0.9311,
      "table_teds_page_avg": null,
      "formula_cdm": 0.9701
    },
    "display_metrics": {
      "overall": 95.46,
      "table_teds": 93.11,
      "formula_cdm": 97.01
    },
    "run_type": "resumed",
    "evidence_level": "cross-checked against the MinerU-ROCm windows-hip model card to 1e-6; per-cell evidence in docs/benchmarks/leaderboard-evidence-2026-08-01.md.",
    "repo_commit": null,
    "profile_hash": null,
    "prediction_tree_hash": null,
    "result_hashes": null,
    "evidence_document": "docs/benchmarks/leaderboard-evidence-2026-08-01.md"
  },
  {
    "id": "mineru-3.4.4-pipeline-2026-08-01",
    "model": "MinerU 3.4.4",
    "model_version": "3.4.4",
    "adapter": "mineru",
    "backend": "ROCm PyTorch + ONNX DirectML",
    "device": "AMD Ryzen AI MAX+ 395 / Radeon 8060S",
    "gfx_architecture": "gfx1151",
    "driver": null,
    "dataset_version": "OmniDocBench v1.6 (1651 pages)",
    "date": "2026-08-01",
    "page_count": 1651,
    "prediction_coverage": null,
    "failed_pages": null,
    "known_failures": null,
    "unknown_failures": null,
    "scoring_mode": "quick_match",
    "aggregation_mode": "quick_match_cdm",
    "raw_metrics": {
      "text_edit_dist": 0.05655,
      "reading_order_edit_dist": 0.15314,
      "table_teds_pooled": 0.8204,
      "table_teds_page_avg": null,
      "formula_cdm": 0.8339
    },
    "display_metrics": {
      "overall": 86.59,
      "table_teds": 82.04,
      "formula_cdm": 83.39
    },
    "run_type": "resumed",